{
    "$schema": "http://json-schema.org/draft-07/schema#",
    "title": "Observed 1688 reference with optional fields; not the canonical Actor product contract",
    "type": "object",
    "properties": {
        "url": {
            "type": ["string", "null"],
            "format": "uri"
        },
        "title": {
            "type": ["string", "null"]
        },
        "price": {
            "type": ["number", "string", "null"],
            "description": "Explicit source amount; currency is absent in the supplied reference."
        },
        "productLadderPrices": {
            "type": ["array", "null"],
            "items": {},
            "description": "Only [] was observed. Nonempty entry structure has not been verified."
        },
        "moq": {
            "type": ["integer", "null"],
            "minimum": 1
        },
        "weight": {
            "type": ["object", "null"],
            "description": "Only null was observed; populated reference structure is unverified."
        },
        "dimensions": {
            "type": ["object", "null"],
            "description": "Only null was observed; populated reference structure is unverified."
        },
        "images": {
            "type": ["array", "null"],
            "items": {
                "type": ["string", "null"],
                "format": "uri"
            }
        },
        "characteristics": {
            "type": ["array", "null"],
            "items": {
                "type": "object",
                "properties": {
                    "attrName": {
                        "type": ["string", "null"]
                    },
                    "attrValue": {
                        "type": ["string", "null"]
                    }
                }
            }
        },
        "variations": {
            "type": ["array", "null"],
            "items": {
                "type": "object",
                "properties": {
                    "name": {
                        "type": ["string", "null"]
                    },
                    "variants": {
                        "type": ["array", "null"],
                        "items": {
                            "type": "object",
                            "properties": {
                                "name": {
                                    "type": ["string", "null"]
                                },
                                "price": {
                                    "type": ["number", "string", "null"],
                                    "description": "Explicit source amount; currency is absent in the supplied reference."
                                },
                                "image": {
                                    "type": ["string", "null"],
                                    "format": "uri"
                                }
                            }
                        }
                    }
                }
            }
        },
        "productId": {
            "type": ["integer", "string", "null"],
            "minimum": 0,
            "maximum": 9007199254740991
        }
    },
    "description": "No required list: missing fields are accepted by the adapter and become null. Unknown fields are not mapped to Actor output."
}
