{
	"url": "https://www.cnxieku.com/item/20354",
	"title": "福诚鞋业-5553跨境大码2色高帮户外战术靴39-47P72",
	"price": "72",
	"productLadderPrices": [],
	"moq": null,
	"weight": null,
	"dimensions": null,
	"images": [
		"https://oss.cnxieku.com/img/gallery/202610/mGPTbcXb8jPj0UbHfQ.jpg",
		"https://oss.cnxieku.com/img/gallery/202610/4WC7oW9iByq62Fycwv.jpg",
		"https://oss.cnxieku.com/shop/shop/202610/Zre8p32fWp3wuUK054.jpg",
		"https://oss.cnxieku.com/shop/shop/202610/w63c318vkeWdRi3yWN.jpg",
		"https://oss.cnxieku.com/shop/shop/202610/qKUoegk8njKr7ihhPb.jpg",
		"https://oss.cnxieku.com/shop/shop/202610/AauObP7kP9vjCWTsGM.jpg",
		"https://oss.cnxieku.com/shop/shop/202610/ORzFlIZMG2NphdWJEX.jpg",
		"https://oss.cnxieku.com/shop/shop/202610/f6YO4IsRu4Av1pKB9J.jpg",
		"https://oss.cnxieku.com/shop/shop/202610/RMiI1lsuyGk9V7mmcb.jpg",
		"https://oss.cnxieku.com/shop/shop/202610/2qk0xxH4clq8sKyDvq.jpg",
		"https://oss.cnxieku.com/shop/shop/202610/XdV7SJd2CcUkmFM9Z4.jpg",
		"https://oss.cnxieku.com/shop/shop/202610/jNmdJnfJBqRDfXxKvq.jpg",
		"https://oss.cnxieku.com/shop/shop/202610/LfFr8zhcboAll7N9Lw.jpg",
		"https://oss.cnxieku.com/shop/shop/202610/FzZtxgMKOprPFQdQ4s.jpg",
		"https://oss.cnxieku.com/shop/shop/202610/JXindhmvmLfYcyM1j4.jpg",
		"https://oss.cnxieku.com/shop/shop/202610/CJZ7k7cMq6VJjTRLO9.jpg",
		"https://oss.cnxieku.com/shop/shop/202610/W9b0p0mtxYWR4XbPOk.jpg",
		"https://oss.cnxieku.com/shop/shop/202610/e10zzy0gEOB2iocIts.jpg",
		"https://oss.cnxieku.com/shop/shop/202610/VqAo2LQffK2RwU8Fzs.jpg",
		"https://oss.cnxieku.com/shop/shop/202610/6GT5B3591fF33EYlHu.jpg",
		"https://oss.cnxieku.com/shop/shop/202610/4KoPOdULgXlqPNNs93.jpg",
		"https://oss.cnxieku.com/shop/shop/202610/VChFu8Is8GqNtBsqGG.jpg",
		"https://oss.cnxieku.com/shop/shop/202610/9lMFORhByAUNOivAcv.jpg",
		"https://oss.cnxieku.com/shop/shop/202610/t1HhTRDtnNJYYhRNo0.jpg",
		"https://oss.cnxieku.com/shop/shop/202610/EKLwjhNJtz9K8FbWY9.jpg",
		"https://oss.cnxieku.com/shop/shop/202610/oLyatdgWQPGENZ0t3s.jpg",
		"https://oss.cnxieku.com/shop/shop/202610/4slaQq8ezSibNJTza4.jpg",
		"https://oss.cnxieku.com/shop/shop/202610/H3D5I34piz8QCYXs8U.jpg",
		"https://oss.cnxieku.com/shop/shop/202610/Y1ZOZsbbQLjqet1G77.jpg",
		"https://oss.cnxieku.com/shop/shop/202610/WGUO8CZJug9nscKTod.jpg",
		"https://oss.cnxieku.com/shop/shop/202610/NIF5Mn3CZdQQ1Nu66l.jpg",
		"https://oss.cnxieku.com/shop/shop/202610/aB7dszZidOr9yVCvOS.jpg",
		"https://oss.cnxieku.com/shop/shop/202610/TRQ0ijz3QnNV5UU5nq.jpg"
	],
	"characteristics": [
		{
			"attrName": "鞋底材质",
			"attrValue": "TPR"
		},
		{
			"attrName": "鞋面材质",
			"attrValue": "人造革"
		},
		{
			"attrName": "闭合方式",
			"attrValue": "系带"
		},
		{
			"attrName": "适用季节",
			"attrValue": "通用"
		},
		{
			"attrName": "productWeight",
			"attrValue": "0.000 kg"
		}
	],
	"variations": [
		{
			"name": "Variación",
			"variants": [
				{
					"name": "颜色:棕色:尺码:39",
					"price": 72,
					"image": "https://oss.cnxieku.com/img/gallery/202610/mGPTbcXb8jPj0UbHfQ.jpg"
				},
				{
					"name": "颜色:棕色:尺码:40",
					"price": 72,
					"image": "https://oss.cnxieku.com/img/gallery/202610/mGPTbcXb8jPj0UbHfQ.jpg"
				},
				{
					"name": "颜色:棕色:尺码:41",
					"price": 72,
					"image": "https://oss.cnxieku.com/img/gallery/202610/mGPTbcXb8jPj0UbHfQ.jpg"
				},
				{
					"name": "颜色:棕色:尺码:42",
					"price": 72,
					"image": "https://oss.cnxieku.com/img/gallery/202610/mGPTbcXb8jPj0UbHfQ.jpg"
				},
				{
					"name": "颜色:棕色:尺码:43",
					"price": 72,
					"image": "https://oss.cnxieku.com/img/gallery/202610/mGPTbcXb8jPj0UbHfQ.jpg"
				},
				{
					"name": "颜色:棕色:尺码:44",
					"price": 72,
					"image": "https://oss.cnxieku.com/img/gallery/202610/mGPTbcXb8jPj0UbHfQ.jpg"
				},
				{
					"name": "颜色:棕色:尺码:45",
					"price": 72,
					"image": "https://oss.cnxieku.com/img/gallery/202610/mGPTbcXb8jPj0UbHfQ.jpg"
				},
				{
					"name": "颜色:棕色:尺码:46",
					"price": 72,
					"image": "https://oss.cnxieku.com/img/gallery/202610/mGPTbcXb8jPj0UbHfQ.jpg"
				},
				{
					"name": "颜色:棕色:尺码:47",
					"price": 72,
					"image": "https://oss.cnxieku.com/img/gallery/202610/mGPTbcXb8jPj0UbHfQ.jpg"
				},
				{
					"name": "颜色:黑色:尺码:39",
					"price": 72,
					"image": "https://oss.cnxieku.com/img/gallery/202610/4WC7oW9iByq62Fycwv.jpg"
				},
				{
					"name": "颜色:黑色:尺码:40",
					"price": 72,
					"image": "https://oss.cnxieku.com/img/gallery/202610/4WC7oW9iByq62Fycwv.jpg"
				},
				{
					"name": "颜色:黑色:尺码:41",
					"price": 72,
					"image": "https://oss.cnxieku.com/img/gallery/202610/4WC7oW9iByq62Fycwv.jpg"
				},
				{
					"name": "颜色:黑色:尺码:42",
					"price": 72,
					"image": "https://oss.cnxieku.com/img/gallery/202610/4WC7oW9iByq62Fycwv.jpg"
				},
				{
					"name": "颜色:黑色:尺码:43",
					"price": 72,
					"image": "https://oss.cnxieku.com/img/gallery/202610/4WC7oW9iByq62Fycwv.jpg"
				},
				{
					"name": "颜色:黑色:尺码:44",
					"price": 72,
					"image": "https://oss.cnxieku.com/img/gallery/202610/4WC7oW9iByq62Fycwv.jpg"
				},
				{
					"name": "颜色:黑色:尺码:45",
					"price": 72,
					"image": "https://oss.cnxieku.com/img/gallery/202610/4WC7oW9iByq62Fycwv.jpg"
				},
				{
					"name": "颜色:黑色:尺码:46",
					"price": 72,
					"image": "https://oss.cnxieku.com/img/gallery/202610/4WC7oW9iByq62Fycwv.jpg"
				},
				{
					"name": "颜色:黑色:尺码:47",
					"price": 72,
					"image": "https://oss.cnxieku.com/img/gallery/202610/4WC7oW9iByq62Fycwv.jpg"
				}
			]
		}
	],
	"productId": 20354
}