{
    "url": "https://detail.1688.com/offer/793451120729.html",
    "title": "SFR摩托车改装配件大小链轮电摩彩盒包装428/420/428H/520/520H",
    "price": "1.96",
    "productLadderPrices": [],
    "moq": 1,
    "weight": null,
    "dimensions": null,
    "images": [
        "https://cbu01.alicdn.com/img/ibank/O1CN01hPLYzS1C3V0cAOTXA_!!2207925120025-0-cib.jpg",
        "https://cbu01.alicdn.com/img/ibank/O1CN01JjGVrD1C3UoqDT6hf_!!2207925120025-0-cib.jpg",
        "https://cbu01.alicdn.com/img/ibank/O1CN01gTOeK71C3UonBVMjG_!!2207925120025-0-cib.jpg",
        "https://cbu01.alicdn.com/img/ibank/O1CN01jg6SDD1C3UrB7230K_!!2207925120025-0-cib.jpg",
        "https://cbu01.alicdn.com/img/ibank/O1CN01AjJBmg1C3UrCUwq2o_!!2207925120025-0-cib.jpg"
    ],
    "characteristics": [
        {
            "attrName": "适用车型",
            "attrValue": "大中小排量摩托车"
        },
        {
            "attrName": "品牌",
            "attrValue": "SFR"
        },
        {
            "attrName": "用途",
            "attrValue": "摩托车改装"
        },
        {
            "attrName": "加工定制",
            "attrValue": "是"
        },
        {
            "attrName": "尺寸",
            "attrValue": "详询客服 mm"
        },
        {
            "attrName": "型号",
            "attrValue": "428H"
        },
        {
            "attrName": "货号",
            "attrValue": "咨询客服"
        },
        {
            "attrName": "是否跨境出口专供货源",
            "attrValue": "否"
        },
        {
            "attrName": "规格",
            "attrValue": "套链428H镀铜150L+49T17T,套链 428本色120L+42T16T,套链 520H金色108L+34T+13T,套链428H-118L金色+41T+14T,428-42T镀锌,428-42T镀铜,520-42Т黑色,套链428H-116L+42T+15T,套链428H-128L+42T+16T,套链428H-132L+50T+15T"
        },
        {
            "attrName": "是否专利货源",
            "attrValue": "否"
        }
    ],
    "variations": [
        {
            "name": "Variación",
            "variants": [
                {
                    "name": "428-42T镀锌",
                    "price": 1.96,
                    "image": null
                },
                {
                    "name": "428-42T镀铜",
                    "price": 1.96,
                    "image": null
                },
                {
                    "name": "套链428H-128L+42T+16T",
                    "price": 5.04,
                    "image": null
                },
                {
                    "name": "套链 520H金色108L+34T+13T",
                    "price": 6.58,
                    "image": null
                },
                {
                    "name": "套链428H-132L+50T+15T",
                    "price": 5.6,
                    "image": null
                },
                {
                    "name": "520-42Т黑色",
                    "price": 2.66,
                    "image": null
                },
                {
                    "name": "套链428H-116L+42T+15T",
                    "price": 4.76,
                    "image": null
                },
                {
                    "name": "套链 428本色120L+42T16T",
                    "price": 5.18,
                    "image": null
                },
                {
                    "name": "套链428H镀铜150L+49T17T",
                    "price": 6.44,
                    "image": null
                },
                {
                    "name": "套链428H-118L金色+41T+14T",
                    "price": 5.46,
                    "image": null
                }
            ]
        }
    ],
    "productId": 793451120729
}
